ID,Question,opA,opB,answer
1," A 1,200-pound horse eats about seven times it's own weight each year.",TRUE,FALSE,TRUE
2,The average dog requires more food in proportion to its size than a human baby or a cat.,TRUE,FALSE,FALSE
3,A cat has 32 muscles in each ear. ,TRUE,TRUE,TRUE
4,A cat's jaws can move sideways.,TRUE,FALSE,FALSE
5,A chameleon's tongue is three times the length of its body.,TRUE,FALSE,FALSE
6,"A chimpanzee can learn to recognize itself in a mirror, but monkeys can't.",TRUE,FALSE,TRUE
7,"A cow gives nearly 200,000 glasses of milk in her lifetime.",TRUE,FALSE,TRUE
8,A Holstein cow's spots are like a fingerprint or snowflake. No two cows have exactly the same pattern of spots.,TRUE,FALSE,TRUE
